"id","name","cost","converted_cost","type","text","stats","rarity"
2998762095,"Ushat Hardhand","{1}",6,"Administrator - Organizer","He finds the following of tradition foolish and\nlimiting. He thinks that the entire concept of\nsacrifice for others is truly disgusting. He doesn't\nthink much about the idea of perseverance. He sees\nmerrymaking as a waste. He treasures leisure time\nand thinks it is very important in life. He values\npeace over war. He finds the whole idea of\nintrospection completely offensive and contrary to\nthe ideals of a life well-lived. A short sturdy\ncreature fond of work and industry.","","rare"
1969871320,"Thob-Stakud","{4}",4,"Miscellaneous - Tracker","""Everything's is so much easier when you just tell\nthe truth."" Thob-Stakud dreams of bringing lasting\npeace to the world. He doesn't really see the point\nof working hard. He doesn't particularly care about\ncrafts[man]ship. He is affronted by the whole notion\nof maintaining decorum and finds so-called dignified\npeople disgusting. He values knowledge. He doesn't\nfeel strongly about the law. He believes that the\nacquisition of power over others is the ideal goal\nin life and worthy of the highest respect. He has\ngreat respect for fairness. A short sturdy creature\nfond of work and industry.","2/2","uncommon"
4280557681,"Led of the Forkbeard","{G}{4}",7,"Jeweler - Gem cutter","She values knowledge. She feels that those who\nattempt to conceal their emotions are vain and\nfoolish. She values romance. She values a harmonious\nexistence. She views competition as a crucial\ndriving force in the world. She thinks there is\nsomething deeply wrong with people that persevere\nthrough adversity. She doesn't think one way or the\nother about leisure time. She needs alcohol to get\nthrough the working day","","common"
4062334479,"Kulet","{3}",4,"Stoneworker - Mason","""Don't get on my bad side."" Kulet dreams of bringing\nlasting peace to the world. He finds eloquence and\nartful speech off-putting. He is thoroughly\ndisgusted by cooperation. He thinks that\nintrospection is valueless and those that waste time\nin self-examination are deluded fools. He deeply\nrespects skill at arms. He sees friendship as one of\nthe finer things in life. He thinks the quest for\nknowledge is a delusional fantasy. He treasures\nindependence. A short sturdy creature fond of work\nand industry.","","common"
435904006,"Morul","{W}",2,"Craftsdwarf - Potter","""We grow through debate and struggle, even chaos and\ndiscord."" Morul dreams of mastering a skill. She\nsees merrymaking as a waste. She believes it is\nimportant to conceal emotions and refrain from\ncomplaining. She values artwork. She is somewhat put\noff by trade and commerce. She believes the idea of\nwar is utterly repellent and would have peace at all\ncosts. She is completely put off by the idea of\nfriends. She finds the pursuit of knowledge to be a\nwaste of effort. She needs alcohol to get through\nthe working day","1/6","uncommon"
2092279634,"Ber-Dumat","{T}{G}{W}",4,"Other Jobs - Alchemist","She sees life as unfair and doesn't mind it that\nway. She views crafts[man]ship with disgust and\nwould desecrate a so-called masterwork or two if she\ncould get away with it. She respects power. She\nfinds introspection to be a waste of time. She sees\nno value in holding back complaints and concealing\nemotions. She greatly respects those that observe\ndecorum and maintain their dignity. She believes\nthat self-mastery and the denial of impulses are of\nthe highest ideals. A short sturdy creature fond of\nwork and industry.","","rare"
3090859558,"Urdim Smokebeard","{G}{2}{X}{X}{1}",5,"Fishery Worker - Fish cleaner","He would have the world operate in complete harmony\nwithout the least bit of strife or disorder. He\ndisregards tradition. He finds even the abstract\nidea of romance repellent. He believes that little\nis better in life than a good party. He respects\ncommerce. He sees the whole idea of taking time to\nmaster a skill as appalling. He believes it is\nimportant to conceal emotions and refrain from\ncomplaining. A short sturdy creature fond of work\nand industry.","","rare"
1954772195,"Besmar of the Flametongue","{4}{R}{2}{X}{B}",8,"Performance - Keyboardist","She has the highest regard for loyalty. She believes\nthat the acquisition of power over others is the\nideal goal in life and worthy of the highest\nrespect. She holds crafts[man]ship to be of the\nhighest ideals and celebrates talented artisans and\ntheir masterworks. She doesn't think much about the\nidea of perseverance. She finds art offensive and\nwould have it destroyed whenever possible. She\nvalues peace over war. She treasures leisure time\nand thinks it is very important in life. She needs\nalcohol to get through the working day","1/2","rare"
2242577703,"Dumat of the Stoneshield","{1}{T}{G}{4}",7,"Fishery Worker - Fisherdwarf","She believes it is important to conceal emotions and\nrefrain from complaining. She values hard work. She\nvalues cooperation. She doesn't have any strong\nfeelings about tradition. She finds romance\ndistasteful. She believes friendship is a key to the\nideal life. She doesn't particularly care between\nwar and peace. A short sturdy creature fond of work\nand industry.","","mythic"
549483877,"Lor","{U}{2}{2}",1,"Craftsdwarf - Potter","He doesn't care about nature one way or another. He\ntruly values merrymaking and parties. He finds the\nquest for knowledge to be of the very highest value.\nHe finds leisure time wasteful. He views any show of\nemotion as offensive. He is put off by family. He\nvalues tradition. He needs alcohol to get through\nthe working day","1/5","common"
75570621,"Unib Goldforge","{X}{2}{3}",4,"Miscellaneous - Leader","She sees the denial of impulses as a vain and\nfoolish pursuit. She believes that the time taken to\nmaster a skill is a horrible waste. She finds\nherself somewhat disgusted with eloquent speakers.\nShe believes that hard work is one of the highest\nideals and a key to the good life. She is disgusted\nby tranquility and would that the world would\nconstantly churn with noise and activity. She finds\nthose that engage in trade and commerce to be fairly\ndisgusting. She has a deep respect for animals,\nplants and the natural world. A short sturdy\ncreature fond of work and industry.","2/1","mythic"
2334433377,"Ablel-Onol","{U}{4}",4,"Farmer - Milker","She finds artwork boring. She sees cooperation as\nvery important in life. She sees no value in holding\nback complaints and concealing emotions. She doesn't\nreally value independence one way or another. She\nfinds maintaining decorum a silly, fumbling waste of\ntime. She hates those who wield power over others.\nShe respects perseverance. She needs alcohol to get\nthrough the working day","7/4","uncommon"
49334821,"Shorast Stonebeard","{T}{R}",1,"Military - Discipline","She finds leisure time wasteful. She holds nature to\nbe of greater value than most aspects of\ncivilization. She is thoroughly disgusted by\ncooperation. She values a harmonious existence. She\nbelieves that self-mastery and the denial of\nimpulses are of the highest ideals. She values\nfamily. She disregards tradition. She needs alcohol\nto get through the working day","1/7","uncommon"
2047536518,"Besmar Smokestone","{2}{R}",4,"Farmer - Spinner","""Try to focus on the practical side of the matter.""\nBesmar Smokestone dreams of creating a great work of\nart. He values sacrifice. He believes that honesty\nis a high ideal. He hates those who wield power over\nothers. He finds himself somewhat disgusted with\neloquent speakers. He finds romance distasteful. He\ndoesn't particularly respect commerce. He is\ncompletely put off by the idea of friends. He needs\nalcohol to get through the working day","4/5","rare"
1771289986,"Rith of the Hammerbone","{X}{W}{W}{X}",8,"Broker - Persuader","He is offended by leisure time and leisurely living.\nHe finds the acquisition and use of power abhorrent\nand would have all masters toppled. He believes that\nhard work is one of the highest ideals and a key to\nthe good life. He finds moderation and self-control\nto be very important. He does not particularly value\nthe truth. He sees family as one of the most\nimportant things in life. He dislikes cooperation.\nHe needs alcohol to get through the working day","","common"
1180657612,"Id","{2}{T}",2,"Jeweler - Gem cutter","She doesn't care about art one way or another. She\nthinks there is something deeply wrong with people\nthat persevere through adversity. She sees equal\nparts of harmony and discord as part of life. She\nthinks that introspection is valueless and those\nthat waste time in self-examination are deluded\nfools. She values good crafts[man]ship. She strongly\nvalues tranquility and quiet. She has a deep dislike\nof the natural world. A short sturdy creature fond\nof work and industry.","6/1","rare"
2209839459,"Urvad-Ast","{U}{3}{1}",5,"Fishery Worker - Fisherdwarf","He is a firm believer in the value of tradition. He\ndoes not care about family one way or the other. He\ndoesn't see the attainment of knowledge as\nimportant. He holds shrewd and crafty individuals in\nthe lowest esteem. He finds nature somewhat\ndisturbing. He sees lying as an important means to\nan end. He finds the acquisition and use of power\nabhorrent and would have all masters toppled. He\nneeds alcohol to get through the working day","","common"
4005676822,"Thikut Stonehammer","{1}{U}{U}{3}{3}",2,"Jeweler - Gem setter","She sees merrymaking as a waste. She has abandoned\nany attempt at self-control and finds the whole\nconcept deeply offensive. She hates freedom and\nwould crush the independent spirit wherever it is\nfound. She views crafts[man]ship with disgust and\nwould desecrate a so-called masterwork or two if she\ncould get away with it. She doesn't particularly\nvalue loyalty. She finds herself somewhat disgusted\nwith eloquent speakers. She hates those who wield\npower over others. She needs alcohol to get through\nthe working day","","common"
1837654877,"Umeshrir of the Silvershield","{3}{1}{G}{2}",2,"Farmer - Thresher","He finds the whole idea of introspection completely\noffensive and contrary to the ideals of a life well-\nlived. He values knowledge. He is somewhat disgusted\nby romance. He sees competition as reasonably\nimportant. He doesn't care about nature one way or\nanother. He doesn't see cooperation as valuable. He\nreally respects commerce and those that engage in\ntrade. He needs alcohol to get through the working\nday","","uncommon"
522686381,"Eshtan of the Giantskull","{X}",7,"Miner - Miner","""Everything's alright."" Eshtan of the Giantskull\ndreams of becoming a legendary warrior. She thinks\nthat the pursuit of the skills of warfare and\nfighting is a low pursuit indeed. She greatly prizes\nloyalty. She holds shrewd and crafty individuals in\nthe lowest esteem. She finds friendship burdensome.\nShe believes the idea of war is utterly repellent\nand would have peace at all costs. She respects the\ndevelopment of skill. She greatly respects\nindividuals that persevere through their trials and\nlabors. She needs alcohol to get through the working\nday","","mythic"
1721037175,"Mafol","{R}",6,"Stoneworker - Mason","""Our fortunes rise and fall together."" Mafol dreams\nof becoming a legendary warrior. He doesn't\nparticularly care between war and peace. He sees\nworking hard as a foolish waste of time. He doesn't\nparticularly care about crafts[man]ship. He does not\ncare about fairness. He finds blind honesty foolish.\nHe doesn't feel strongly about the law. He values\ndecorum, dignity and proper behavior. He needs\nalcohol to get through the working day","2/1","uncommon"
4168658335,"Etur-Atir","{2}",1,"Military - Discipline","He is somewhat disgusted by romance. He greatly\nrespects the shrewd and guileful. He hates those who\nwield power over others. He has a great deal of\nrespect for worthy crafts[man]ship. He doesn't feel\nstrongly about the law. He holds the view that\ncommerce is a vile obscenity. He doesn't really see\nthe value in self-examination. A short sturdy\ncreature fond of work and industry.","5/1","common"
1744777925,"Kosoth","{2}{X}{G}{3}",5,"Engineer - Siege engineer","She is greatly disturbed by quiet and a peaceful\nexistence. She values artwork. She is a firm\nbeliever in the value of tradition. She sees those\nthat attempt to maintain dignified and proper\nbehavior as vain and offensive. She is somewhat put\noff by trade and commerce. She disdains loyalty. She\ndoesn't feel strongly about the law. A short sturdy\ncreature fond of work and industry.","1/1","uncommon"
73124064,"Doren-Dobar","{T}{1}",6,"Broker - Flatterer","He doesn't see cooperation as valuable. He is a firm\nbeliever in the value of tradition. He thinks there\nis something deeply wrong with people that persevere\nthrough adversity. He deeply respects those that\nwork hard at their labors. He values loyalty. He\ntruly values merrymaking and parties. He doesn't\nhave a preference between tranquility and tumult. He\nneeds alcohol to get through the working day","","rare"
2019650358,"Cilob-Ingish","{1}",5,"Other Jobs - Alchemist","""I finished up some work, I am very satisfied.""\nCilob-Ingish dreams of raising a family. He is\nutterly disgusted by guile and cunning. He sees the\npursuit of good crafts[man]ship as a total waste. He\ndisdains the law. He doesn't see much value in being\nstoic. He thinks romance is very important in life.\nHe values artwork. He believes that honesty is a\nhigh ideal. A short sturdy creature fond of work and\nindustry.","5/5","uncommon"
1048041611,"Kib","{T}{T}{U}{2}",6,"Metalsmith - Furnace operator","She disdains loyalty. She deeply respects eloquent\nspeakers. She is disgusted by merrymakers. She\ndoesn't particularly care between war and peace. She\nbelieves that the mastery of a skill is one of the\nhighest pursuits. She deeply dislikes competition.\nShe believes the truth is inviolable regardless of\nthe cost. A short sturdy creature fond of work and\nindustry.","1/3","mythic"
2617431498,"Medtob","{4}{U}{G}{T}{2}",2,"Broker - Persuader","She believes that it would be a fine thing if all\ntime were leisure time. She thinks there is\nsomething deeply wrong with people that persevere\nthrough adversity. She doesn't see cooperation as\nvaluable. She doesn't feel strongly about the law.\nShe sees merrymaking as a waste. She doesn't\nparticularly respect commerce. She thinks that the\nentire concept of sacrifice for others is truly\ndisgusting. She needs alcohol to get through the\nworking day","","uncommon"
1072859972,"Edzul","{B}{2}{T}",4,"Administrator - Organizer","""I'm feeling randy today!"" Edzul dreams of attaining\nrank in society. She doesn't have a preference\nbetween tranquility and tumult. She really respects\nthose that take the time to master a skill. She\ndoesn't have any strong feelings about tradition.\nShe finds introspection to be a waste of time. She\nvalues artwork. She does not care about friendship.\nShe is somewhat put off by trade and commerce. A\nshort sturdy creature fond of work and industry.","","mythic"
718890589,"Reg-Momuz","{B}{U}{G}{W}{U}",6,"Other Jobs - Knapper","""Try to focus on the practical side of the matter.""\nReg-Momuz dreams of crafting a masterwork someday.\nHe places cooperation as one of the highest ideals.\nHe really respects commerce and those that engage in\ntrade. He respects the law. He values eloquence. He\nvalues cunning. He values family greatly. He sees\nintrospection as important. A short sturdy creature\nfond of work and industry.","","rare"
3310596727,"Ineth-Zuglar","{2}{X}",7,"Miscellaneous - Observer","""Try to focus on the practical side of the matter.""\nIneth-Zuglar dreams of ruling the world. She\nrespects power. She does not really value cunning\nand guile. She truly values merrymaking and parties.\nShe is disgusted by the idea of fairness and will\nfreely cheat anybody at any time. She doesn't\nparticularly respect commerce. She sees competition\nas wasteful and silly. She has a great deal of\nrespect for the law. A short sturdy creature fond of\nwork and industry.","","rare"
541116389,"Dastot Oneshield","{T}",7,"Broker - Judge of intent","""Life is, in a word, torture."" Dastot Oneshield\ndreams of attaining rank in society. She values hard\nwork. She does not care about fairness. She views\nany show of emotion as offensive. She doesn't feel\nstrongly about the law. She does not care about\nfriendship. She finds the ideas of independence and\nfreedom somewhat foolish. She holds the maintenance\nof tradition as one of the highest ideals. A short\nsturdy creature fond of work and industry.","1/6","uncommon"
4140871352,"Tirist of the Thunderhammer","{4}",7,"Military - Armor user","He strongly values tranquility and quiet. He greatly\nrespects the shrewd and guileful. He respects fair-\ndealing and fair-play. He is affronted by the whole\nnotion of maintaining decorum and finds so-called\ndignified people disgusting. He doesn't find power\nparticularly praiseworthy. He deeply respects skill\nat arms. He values nature. A short sturdy creature\nfond of work and industry.","7/1","common"
1875900626,"Asen","{T}",3,"Administrator - Building designer","She is greatly disturbed by quiet and a peaceful\nexistence. She sees freedom and independence as\ncompletely worthless. She doesn't feel strongly\nabout the law. She believes that the time taken to\nmaster a skill is a horrible waste. She deeply\nrespects skill at arms. She hates those who wield\npower over others. She views the pursuit of\nknowledge as deeply important. A short sturdy\ncreature fond of work and industry.","3/1","mythic"
3725877335,"Id","{1}{4}",4,"Ranger - Trapper","He sees engaging in commerce as a high ideal in\nlife. He finds the idea of laws abhorrent. He views\ndecorum as a high ideal and is deeply offended by\nthose that fail to maintain it. He does not really\nvalue cunning and guile. He finds sacrifice to be\nthe height of folly. He really respects those that\ntake the time to master a skill. He sees\nintrospection as important. A short sturdy creature\nfond of work and industry.","5/2","uncommon"
2394216394,"Litast","{B}",7,"Miner - Miner","She respects fair-dealing and fair-play. She is\ndisgusted by tranquility and would that the world\nwould constantly churn with noise and activity. She\nsees competition as wasteful and silly. She abhors\nthose that pursue the mastery of weapons and skill\nwith fighting. She doesn't find power particularly\npraiseworthy. She believes that perseverance is one\nof the greatest qualities somebody can have. She is\nthoroughly disgusted by cooperation. She needs\nalcohol to get through the working day","1/7","mythic"
3515671989,"Erith","{4}",3,"Miner - Miner","She doesn't care very much about decorum. She sees\nlying as an important means to an end. She sees\npower over others as something to strive for. She\ntreasures leisure time and thinks it is very\nimportant in life. She values artwork. She respects\nthe development of skill. She has abandoned any\nattempt at self-control and finds the whole concept\ndeeply offensive. A short sturdy creature fond of\nwork and industry.","5/2","uncommon"
1140809286,"Mafol Dugdeep","{U}{2}{2}{R}",3,"Metalsmith - Metalsmith","""Don't get on my bad side."" Mafol Dugdeep dreams of\ncrafting a masterwork someday. He finds eloquence\nand artful speech off-putting. He doesn't\nparticularly care about crafts[man]ship. He believes\nthat the time taken to master a skill is a horrible\nwaste. He respects fair-dealing and fair-play. He\ndoesn't think one way or the other about leisure\ntime. He finds romance distasteful. He thinks it is\nof the utmost importance to present a bold face and\nnever grouse, complain or even show emotion. He\nneeds alcohol to get through the working day","","uncommon"
1950141431,"Kosoth of the Grimblade","{B}",5,"Military - Axeman","""Don't get on my bad side."" Kosoth of the Grimblade\ndreams of making a great discovery. He values\nsacrifice. He finds leisure time wasteful. He does\nnot care about friendship. He values knowledge. He\nsees competition as wasteful and silly. He sees\nworking hard as a foolish waste of time. He\ndisregards tradition. He needs alcohol to get\nthrough the working day","4/6","rare"
2526274732,"Tholtig Grimshield","{W}{X}{G}",4,"Scholar - Writer","He does not really value cunning and guile. He finds\nintrospection to be a waste of time. He dislikes\ncooperation. He doesn't particularly value loyalty.\nHe values family. He doesn't particularly respect\nsacrifice as a virtue. He values peace over war. He\nneeds alcohol to get through the working day","5/4","rare"
28408917,"Zon of the Stonemarrow","{G}{U}{W}",4,"Scholar - Logician","She doesn't really see the point of working hard.\nShe is completely put off by the idea of friends.\nShe disregards tradition. She greatly respects those\nthat observe decorum and maintain their dignity. She\nholds shrewd and crafty individuals in the lowest\nesteem. She sees the whole pursuit of art as silly.\nShe values romance. A short sturdy creature fond of\nwork and industry.","","rare"
136527368,"Avuz Goldseeker","{2}{3}{T}",8,"Farmer - Potash maker","He respects perseverance. He does not really value\nskills related to fighting. He believes that the\nacquisition of power over others is the ideal goal\nin life and worthy of the highest respect. He\ndoesn't particularly value loyalty. He has great\nrespect for fairness. He finds those that deny their\nimpulses somewhat stiff. He hates freedom and would\ncrush the independent spirit wherever it is found. A\nshort sturdy creature fond of work and industry.","7/1","mythic"
45545369,"Tholtig-Rakust","{W}{X}",1,"Performance - Percussionist","""Nobody is free, and it is pointless to act as if\nyou are."" Tholtig-Rakust dreams of attaining rank in\nsociety. She doesn't particularly care about\ncrafts[man]ship. She sees life as unfair and doesn't\nmind it that way. She thinks there is something\ndeeply wrong with people that persevere through\nadversity. She sees romance as one of the highest\nideals. She disdains the law. She values peace over\nwar. She views cooperation as a low ideal not worthy\nof any respect. She needs alcohol to get through the\nworking day","","common"
12106124,"Momuz-Ablel","{1}{G}{4}{3}{3}",5,"Jeweler - Gem cutter","""We grow through debate and struggle, even chaos and\ndiscord."" Momuz-Ablel dreams of becoming a legendary\nwarrior. She thinks the quest for knowledge is a\ndelusional fantasy. She believes that martial\nprowess defines the good character of an individual.\nShe finds the acquisition and use of power abhorrent\nand would have all masters toppled. She doesn't\nthink one way or the other about leisure time. She\ndoesn't feel strongly about the law. She views\ncooperation as a low ideal not worthy of any\nrespect. She is somewhat put off by trade and\ncommerce. A short sturdy creature fond of work and\nindustry.","2/2","uncommon"
3463768300,"Deduk of the Forkbeard","{2}{1}{G}{B}",3,"Ranger - Ambusher","He values loyalty. He sees the denial of impulses as\na vain and foolish pursuit. He doesn't really value\nindependence one way or another. He sees sacrifice\nas wasteful and foolish. He thinks there is\nsomething deeply wrong with people that persevere\nthrough adversity. He finds the idea of laws\nabhorrent. He doesn't particularly care about\ncrafts[man]ship. A short sturdy creature fond of\nwork and industry.","1/7","mythic"
2651790430,"Ast Ironnugget","{4}{3}{3}{U}",1,"Miner - Miner","""I'm at my best under pressure."" Ast Ironnugget\ndreams of creating a great work of art. He doesn't\nfeel strongly about the law. He doesn't have any\nstrong feelings about tradition. He prefers a noisy,\nbustling life to boring days without activity. He\nvalues independence. He believes that those who\nsacrifice for others should be deeply respected. He\nhas a deep respect for animals, plants and the\nnatural world. He finds maintaining decorum a silly,\nfumbling waste of time. He needs alcohol to get\nthrough the working day","6/6","uncommon"
1156484597,"Lorbam of the Firehammer","{1}",5,"Jeweler - Gem setter","She values independence. She respects fair-dealing\nand fair-play. She believes deeply that chaos and\ndisorder are the truest expressions of life and\nwould disrupt harmony wherever it is found. She\nbelieves that those that take leisure time are evil\nand finds the whole idea disgusting. She views\ncooperation as a low ideal not worthy of any\nrespect. She is an absolute believer in the rule of\nlaw. She sees the whole pursuit of art as silly. A\nshort sturdy creature fond of work and industry.","5/2","mythic"
